domain,is_relevant,category,opportunity_type,rationale,model,enriched_at
solutionsuggest.com,false,aggregator_or_listicle,not_applicable,"Generic name, very low authority rank, links all major competitors—classic programmatic farm with minimal editorial value.",claude-haiku-4-5,2026-07-22 22:18:18.499186
spotify.com,false,other,not_applicable,Spotify is a music streaming platform with no BI/analytics focus; link to Hex is likely incidental or unrelated to data analytics.,claude-haiku-4-5,2026-07-22 22:19:00.218969
stackshare.io,true,community_or_directory,directory_listing,StackShare is a high-authority tech community directory; Omni likely needs a profile listing to match competitor visibility.,claude-haiku-4-5,2026-07-22 22:19:39.922266
startupik.com,false,junk_or_spam,not_applicable,"Generic name, low authority rank, links all four competitors—classic programmatic farm with no editorial value.",claude-haiku-4-5,2026-07-22 22:16:22.439392
statspresso.com,false,junk_or_spam,not_applicable,"Generic name, very low authority rank, links all four competitors—classic programmatic content farm.",claude-haiku-4-5,2026-07-22 22:16:44.8546
statuspage.io,false,developer_tool_vendor,not_applicable,"Statuspage.io is a status-monitoring tool for incident communication, not a BI/analytics platform or data-stack vendor; no integration opportunity.",claude-haiku-4-5,2026-07-22 22:19:21.015779
statussight.com,false,junk_or_spam,not_applicable,Low-authority domain linking to all four competitors signals programmatic content farm; no editorial value.,claude-haiku-4-5,2026-07-22 22:16:28.43918
stitchdata.com,true,data_platform_vendor,integrations_page,Stitch Data (Talend ELT platform) lists BI integrations; strong partner opportunity for Omni integration directory listing.,claude-haiku-4-5,2026-07-22 22:19:57.553528
stork.ai,false,junk_or_spam,not_applicable,Low-authority domain (rank 7.3M) linking to 3 competitors suggests programmatic content farm; unlikely to yield valuable backlink.,claude-haiku-4-5,2026-07-22 22:18:17.220271
stravito.com,false,junk_or_spam,not_applicable,Generic domain name with low authority linking to all four competitors signals programmatic content farm; no editorial value.,claude-haiku-4-5,2026-07-22 22:16:27.348847
stripe.com,false,other,not_applicable,"Stripe is a payments platform, not a data/analytics ecosystem player; unlikely to feature BI tools prominently or accept guest content on analytics topics.",claude-haiku-4-5,2026-07-22 22:19:27.073752
t.me,false,junk_or_spam,not_applicable,t.me is Telegram's messaging platform; not a content/editorial domain suitable for BI platform backlinks.,claude-haiku-4-5,2026-07-22 22:19:06.679826
taskade.com,false,developer_tool_vendor,not_applicable,"Taskade is a productivity/collaboration tool, not a BI platform or data-stack vendor; mentions of competitors are incidental, not editorial focus.",claude-haiku-4-5,2026-07-22 22:19:48.021453
technically.dev,true,tech_media_or_blog,content_mention,Developer-focused tech blog covering BI/analytics tools; strong outreach target for guest content or tool mentions.,claude-haiku-4-5,2026-07-22 22:18:06.366385
thehackernews.com,true,tech_media_or_blog,content_mention,High-authority tech news site covering data/analytics tools; strong domain for guest content or product mentions.,claude-haiku-4-5,2026-07-22 22:19:05.249746
thenextgentechinsider.com,false,junk_or_spam,not_applicable,Low-authority domain (rank 2.6M) linking to 3 competitors signals programmatic content farm; minimal SEO value.,claude-haiku-4-5,2026-07-22 22:18:03.57794
toolcenter.ai,false,junk_or_spam,not_applicable,Low-authority domain (rank 16.8M) linking to 3 competitors signals programmatic content farm; minimal SEO value.,claude-haiku-4-5,2026-07-22 22:18:52.55013
toolradar.com,false,aggregator_or_listicle,not_applicable,"Generic tool-comparison site with low authority; links to 3 competitors suggests thin, programmatic listicle content.",claude-haiku-4-5,2026-07-22 22:18:42.822426
trino.io,true,data_platform_vendor,integrations_page,Trino is a distributed SQL query engine; integrations pages typically list BI tools as downstream consumers.,claude-haiku-4-5,2026-07-22 22:19:34.301884
twilio.com,false,data_platform_vendor,not_applicable,"Twilio is a communications platform, not a BI/analytics vendor; links to competitors are incidental to their core product focus.",claude-haiku-4-5,2026-07-22 22:18:57.670485
uproger.com,false,junk_or_spam,not_applicable,Low-authority domain (rank 7.1M) with generic name linking to multiple competitors; likely programmatic content farm.,claude-haiku-4-5,2026-07-22 22:18:15.621376
usepropane.ai,false,junk_or_spam,not_applicable,"Generic name, very low authority rank, links all four competitors—classic programmatic content farm signal.",claude-haiku-4-5,2026-07-22 22:16:35.637152
v7labs.com,true,developer_tool_vendor,integrations_page,V7Labs (computer vision/data labeling platform) lists BI tools in integrations; strong partner-adjacent opportunity for Omni inclusion.,claude-haiku-4-5,2026-07-22 22:20:01.432223
vendr.com,true,community_or_directory,directory_listing,Vendr is a SaaS procurement directory; listing Omni alongside competitors suggests strong directory inclusion opportunity.,claude-haiku-4-5,2026-07-22 22:16:59.604132
verysaas.io,false,aggregator_or_listicle,not_applicable,"Low-authority SaaS aggregator with generic name; links to 3 competitors suggest thin, programmatic listicle content.",claude-haiku-4-5,2026-07-22 22:18:33.402104
visme.co,true,developer_tool_vendor,integrations_page,Visme is a design/visualization platform with integrations directory; strong authority and existing BI platform links suggest receptiveness to Omni partnership.,claude-haiku-4-5,2026-07-22 22:19:23.986939
waveup.com,false,junk_or_spam,not_applicable,Low-authority domain (rank 6.9M) linking to 3 competitors signals programmatic content farm; minimal SEO value.,claude-haiku-4-5,2026-07-22 22:18:10.938804
webcatalog.io,false,aggregator_or_listicle,not_applicable,"WebCatalog is a generic software directory with low editorial curation; unlikely to provide contextual, high-quality backlinks.",claude-haiku-4-5,2026-07-22 22:20:07.692116
websitedesignawards.com,false,junk_or_spam,not_applicable,Website design awards site with no BI/analytics focus; low authority rank and competitor links suggest programmatic content farm.,claude-haiku-4-5,2026-07-22 22:18:48.278533
welcometothejungle.com,false,other,not_applicable,Welcome to the Jungle is a European job board; not a data/analytics content platform suitable for BI tool backlinks.,claude-haiku-4-5,2026-07-22 22:16:56.617646
wicle.io,false,junk_or_spam,not_applicable,"Very low authority (rank 11M+) with links to 3 competitors suggests thin programmatic content farm, not editorial opportunity.",claude-haiku-4-5,2026-07-22 22:18:41.130447
wishket.com,false,aggregator_or_listicle,not_applicable,Wishket is a freelance marketplace; links to 3 competitors suggest programmatic BI tool aggregation rather than editorial coverage.,claude-haiku-4-5,2026-07-22 22:17:14.735459
worldmetrics.org,false,junk_or_spam,not_applicable,"Generic name, mid-tier authority, links all four competitors—classic programmatic content farm with no editorial value.",claude-haiku-4-5,2026-07-22 22:16:20.07317
xenonstack.com,true,tech_media_or_blog,content_mention,XenonStack is a tech consultancy/blog covering data platforms; strong authority and editorial coverage of BI tools presents guest content or mention opportunity.,claude-haiku-4-5,2026-07-22 22:17:44.862035
ycombinator.com,false,community_or_directory,not_applicable,"Y Combinator is a prestigious startup accelerator; linking to portfolio companies is editorial, not a partnership opportunity for outreach.",claude-haiku-4-5,2026-07-22 22:16:03.01157
